{
  "schema_version": 1,
  "feed_version": 1,
  "generated_at": "2026-07-18T18:45:00Z",
  "articles": [
    {
      "id": "n0001-f71a0e79",
      "status": "published",
      "published_at": "2026-01-01T08:00:00Z",
      "legal_status": "effective",
      "source_type": "official",
      "effective_date": "2026-01-01",
      "tax_year": 2026,
      "affects_calculator": true,
      "requires_app_update": false,
      "source_urls": [
        "https://cyprus-mail.com/2025/12/22/house-approves-tax-reform-bills",
        "https://globaltaxnews.ey.com/news/2026-0140-cyprus-enacts-major-tax-reform-legislation",
        "https://www.tridenttrust.com/knowledge/news/summary-of-cyprus-s-2026-tax-reforms",
        "https://www.sovereigngroup.com/news/cyprus-brings-comprehensive-tax-reform-into-force/"
      ],
      "locales": {
        "en": {
          "headline": "Cyprus enacts first broad tax reform in over a decade",
          "summary": "Cyprus's comprehensive 2026 tax reform took effect on 1 January 2026, reshaping personal income tax bands, adding new personal deductions, cutting the Special Defence Contribution on dividends, raising the corporate tax rate to 15%, and abolishing stamp duty on most transactions. For individuals, it changes how much income tax you pay and introduces new deductions for children, primary-residence housing, green upgrades, and insurance.",
          "body": "The reform affects all individual taxpayers in Cyprus. The House of Representatives approved the package on 22 December 2025, it was published in the Government Gazette on 31 December 2025, and it took effect on 1 January 2026. It reshapes the personal income tax bands, adds new personal deductions (children, primary-residence housing, green upgrades, and insurance), cuts the Special Defence Contribution on dividends, raises the corporate tax rate to 15%, and abolishes stamp duty on most transactions. It is Cyprus's first broad tax overhaul in over a decade and mainly aims to relieve households and modernise the system.",
          "disclaimer": "General information, not tax or legal advice."
        },
        "ru": {
          "headline": "Кипр принял первую за десятилетие масштабную налоговую реформу",
          "summary": "Комплексная налоговая реформа Кипра 2026 года вступила в силу 1 января 2026 года: она перестраивает ступени подоходного налога, вводит новые персональные вычеты, снижает Специальный взнос на оборону с дивидендов, повышает ставку корпоративного налога до 15% и отменяет гербовый сбор по большинству сделок. Для физических лиц она меняет размер уплачиваемого подоходного налога и вводит новые вычеты — на детей, основное жильё, энергоэффективные улучшения и страхование.",
          "body": "Реформа затрагивает всех физических лиц — налогоплательщиков Кипра. Палата представителей одобрила пакет 22 декабря 2025 года, он был опубликован в Официальной газете 31 декабря 2025 года и вступил в силу 1 января 2026 года. Реформа перестраивает ступени подоходного налога, добавляет новые персональные вычеты (на детей, основное жильё, энергоэффективные улучшения и страхование), снижает Специальный взнос на оборону с дивидендов, повышает ставку корпоративного налога до 15% и отменяет гербовый сбор по большинству сделок. Это первая за более чем десятилетие широкая налоговая реформа страны, направленная прежде всего на облегчение нагрузки на домохозяйства и модернизацию системы.",
          "disclaimer": "Общая информация, не является налоговой или юридической консультацией."
        },
        "el": {
          "headline": "Η Κύπρος θεσπίζει την πρώτη ευρεία φορολογική μεταρρύθμιση σε μια δεκαετία",
          "summary": "Η ολοκληρωμένη φορολογική μεταρρύθμιση της Κύπρου για το 2026 τέθηκε σε ισχύ την 1η Ιανουαρίου 2026, αναδιαμορφώνοντας τις κλίμακες του φόρου εισοδήματος, προσθέτοντας νέες προσωπικές εκπτώσεις, μειώνοντας την Έκτακτη Εισφορά για την Άμυνα επί των μερισμάτων, αυξάνοντας τον εταιρικό φορολογικό συντελεστή στο 15% και καταργώντας τα τέλη χαρτοσήμου στις περισσότερες συναλλαγές. Για τα φυσικά πρόσωπα, αλλάζει το ύψος του φόρου εισοδήματος που καταβάλλουν και εισάγει νέες εκπτώσεις για παιδιά, κύρια κατοικία, ενεργειακές αναβαθμίσεις και ασφάλιση.",
          "body": "Η μεταρρύθμιση αφορά όλα τα φυσικά πρόσωπα - φορολογούμενους στην Κύπρο. Η Βουλή των Αντιπροσώπων ενέκρινε το πακέτο στις 22 Δεκεμβρίου 2025, δημοσιεύθηκε στην Επίσημη Εφημερίδα της Δημοκρατίας στις 31 Δεκεμβρίου 2025 και τέθηκε σε ισχύ την 1η Ιανουαρίου 2026. Αναδιαμορφώνει τις κλίμακες του φόρου εισοδήματος, προσθέτει νέες προσωπικές εκπτώσεις (παιδιά, κύρια κατοικία, ενεργειακές αναβαθμίσεις και ασφάλιση), μειώνει την Έκτακτη Εισφορά για την Άμυνα επί των μερισμάτων, αυξάνει τον εταιρικό φορολογικό συντελεστή στο 15% και καταργεί τα τέλη χαρτοσήμου στις περισσότερες συναλλαγές. Είναι η πρώτη ευρεία φορολογική αναθεώρηση της χώρας εδώ και πάνω από μία δεκαετία και στοχεύει κυρίως στην ανακούφιση των νοικοκυριών και στον εκσυγχρονισμό του συστήματος.",
          "disclaimer": "Γενική ενημέρωση, δεν αποτελεί φορολογική ή νομική συμβουλή."
        }
      },
      "image": "images/n0001-f71a0e79.jpg",
      "image_alt": {
        "en": "Cyprus coastal town at sunrise with abstract renewal arrows",
        "ru": "Кипрский прибрежный город на рассвете, абстрактные стрелки обновления",
        "el": "Παραθαλάσσια πόλη της Κύπρου την αυγή με αφηρημένα βέλη ανανέωσης"
      },
      "content_hash": "996b558425130c6e1af29cd9a5cba968c2c9d5874882eabefbc71b3c25ae050f"
    },
    {
      "id": "n0002-9001b98e",
      "status": "published",
      "published_at": "2026-01-01T08:00:00Z",
      "legal_status": "effective",
      "source_type": "official",
      "effective_date": "2026-01-01",
      "tax_year": 2026,
      "affects_calculator": true,
      "requires_app_update": false,
      "source_urls": [
        "https://cyprus-mail.com/2025/12/22/house-approves-tax-reform-bills",
        "https://ibccs.tax/blog/cyprus-personal-income-tax-2026/",
        "https://www.chambers.law/cyprus-tax-reform-2026-key-changes-for-individuals-and-businesses/",
        "https://assets.kpmg.com/content/dam/kpmg/cy/pdf/2026/cyprus-tax-reform.pdf"
      ],
      "locales": {
        "en": {
          "headline": "Income tax-free threshold rises to €22,000 from 2026",
          "summary": "From 1 January 2026 the personal income tax-free threshold rises from €19,500 to €22,000, and new progressive bands apply above it. Because the higher rates now start at higher income levels, most employees and pensioners keep more of their income.",
          "body": "This affects everyone with taxable income in Cyprus. From 1 January 2026 the bands are: 0 to €22,000 at 0%; €22,001 to €32,000 at 20%; €32,001 to €42,000 at 25%; €42,001 to €72,000 at 30%; and over €72,000 at 35%.",
          "disclaimer": "General information, not tax or legal advice."
        },
        "ru": {
          "headline": "Необлагаемый минимум по подоходному налогу вырастет до 22 000 €",
          "summary": "С 1 января 2026 года необлагаемый минимум по подоходному налогу повышается с 19 500 € до 22 000 €, а над ним вводятся новые прогрессивные ставки. Поскольку более высокие ставки теперь начинаются с более высоких уровней дохода, большинство работников и пенсионеров сохраняют больше своего дохода.",
          "body": "Изменение затрагивает всех, у кого есть налогооблагаемый доход на Кипре. С 1 января 2026 года действуют ставки: от 0 до 22 000 € — 0%; от 22 001 до 32 000 € — 20%; от 32 001 до 42 000 € — 25%; от 42 001 до 72 000 € — 30%; свыше 72 000 € — 35%.",
          "disclaimer": "Общая информация, не является налоговой или юридической консультацией."
        },
        "el": {
          "headline": "Το αφορολόγητο όριο φόρου εισοδήματος αυξάνεται στις 22.000 € το 2026",
          "summary": "Από την 1η Ιανουαρίου 2026 το αφορολόγητο όριο του φόρου εισοδήματος αυξάνεται από 19.500 € σε 22.000 €, ενώ πάνω από αυτό ισχύουν νέοι προοδευτικοί συντελεστές. Επειδή οι υψηλότεροι συντελεστές ξεκινούν πλέον σε υψηλότερα επίπεδα εισοδήματος, οι περισσότεροι εργαζόμενοι και συνταξιούχοι κρατούν μεγαλύτερο μέρος του εισοδήματός τους.",
          "body": "Αφορά όλους όσους έχουν φορολογητέο εισόδημα στην Κύπρο. Από την 1η Ιανουαρίου 2026 ισχύουν οι εξής συντελεστές: από 0 έως 22.000 € με 0%· από 22.001 έως 32.000 € με 20%· από 32.001 έως 42.000 € με 25%· από 42.001 έως 72.000 € με 30%· και άνω των 72.000 € με 35%.",
          "disclaimer": "Γενική ενημέρωση, δεν αποτελεί φορολογική ή νομική συμβουλή."
        }
      },
      "image": "images/n0002-9001b98e.jpg",
      "image_alt": {
        "en": "Ascending blocks with coins, tax bands",
        "ru": "Восходящие блоки с монетами — налоговые ступени",
        "el": "Ανοδικά μπλοκ με νομίσματα, φορολογικές κλίμακες"
      },
      "content_hash": "18fe70654a64b49d27bbe3c23cd80cc2b5f0c28dc7e3a4e235ca580408b38e99"
    },
    {
      "id": "n0003-058bef45",
      "status": "published",
      "published_at": "2026-01-01T08:00:00Z",
      "legal_status": "effective",
      "source_type": "professional_analysis",
      "effective_date": "2026-01-01",
      "tax_year": 2026,
      "affects_calculator": true,
      "requires_app_update": false,
      "source_urls": [
        "https://pgeconomides.eu/news/cyprus-tax-reform-2026-personal-tax-changes-impacting-payroll/",
        "https://www.gov.cy/mof-tfa/forologiki-metarrythmisi-2026/",
        "https://willowserve.solutions/2025/12/31/cyprus-personal-income-tax-reform-2026/"
      ],
      "locales": {
        "en": {
          "headline": "New income tax deduction for each child from 2026",
          "summary": "From 1 January 2026, each parent can claim a new income tax deduction for every child, ranging from €1,000 to €1,500 depending on the child's order in the family. If your family income stays within the set limits, this lowers the amount of income on which you pay tax, and single parents receive double the deduction.",